{
  "schema_version": 1,
  "id": "home-assistant",
  "name": "Home Assistant",
  "description": "Open source home automation that puts local control and privacy first. Control all your devices from a single, unified interface.",
  "version": "2025.7.4",
  "category": "automation",
  "icon": "🏠",
  "author": "Home Assistant",
  "website": "https://www.home-assistant.io/",
  "repository": "https://github.com/home-assistant/core",
  "tags": [
    "home-automation",
    "iot",
    "smart-home",
    "automation",
    "dashboard"
  ],
  "ports": [
    {
      "host": 8123,
      "container": 8123,
      "protocol": "tcp",
      "description": "Web interface"
    }
  ],
  "volumes": [
    {
      "host": "./config",
      "container": "/config",
      "mode": "rw",
      "description": "Configuration files"
    }
  ],
  "environment": [
    {
      "name": "TZ",
      "label": "Tz",
      "description": "Timezone for the application",
      "default": "Europe/Berlin",
      "required": false,
      "secret": false,
      "generate": false
    }
  ],
  "requirements": {
    "memory": "1GB",
    "cpu": "2 cores",
    "disk": "5GB"
  },
  "notes": [
    "Home Assistant runs in host network mode for device discovery",
    "First start may take several minutes to initialize",
    "Access the web interface at http://your-server:8123",
    "Create your admin account on first login",
    "Many integrations require additional configuration",
    "USB devices (Zigbee/Z-Wave) need to be passed through to the container",
    "For USB devices, add device mappings in docker-compose.yml",
    "Consider using the supervised installation for add-ons support"
  ],
  "privileged": true,
  "network_mode": "host",
  "update": {
    "strategy": "compose-pull-recreate"
  }
}
